{
  "problem_id": 130,
  "problem_title": "Problem 130",
  "misconception_id": 3,
  "misconception_description": "Student believes that function parameters automatically change in recursive calls without explicit modification.",
  "solutions": [
    {
      "solution_index": 0,
      "generated_code": "def next_smallest_palindrome(num):\n    if str(num + 1) == str(num + 1)[::-1]:\n        return num + 1\n    return next_smallest_palindrome(num)",
      "reasoning": "The misconception is: \"Student believes that function parameters automatically change in recursive calls without explicit modification.\"\n\nLooking at the given implementation, it's an iterative solution using a for loop. It doesn't use recursion at all. \n\nTo exhibit this misconception, I need to rewrite the solution to use recursion, but the student would fail to modify the parameter in the recursive call, believing it will change automatically.\n\nA recursive approach to this problem would be:\n1. Check if num+1 is a palindrome\n2. If yes, return it\n3. If no, recursively call with num+1\n\nBut with the misconception, the student would:\n1. Check if num+1 is a palindrome\n2. If yes, return it\n3. If no, recursively call with num (without incrementing), believing it will automatically increment\n\nLet me write this:\n\ndef next_smallest_palindrome(num):\n    candidate = num + 1\n    if str(candidate) == str(candidate)[::-1]:\n        return candidate\n    return next_smallest_palindrome(num)  # Should be next_smallest_palindrome(candidate) or next_smallest_palindrome(num+1)\nWait, but this would cause infinite recursion. The student believes the parameter will change automatically, so from their perspective, they think `num` will increment on its own in each recursive call.\n\nActually, looking at the example more carefully:\n- The student calls `factorial(n)` instead of `factorial(n-1)`\n- They believe `n` will automatically decrement\n\nSimilarly, for the palindrome problem:\n- The student should call `next_smallest_palindrome(num)` instead of `next_smallest_palindrome(num+1)`\n- They believe `num` will automatically increment\n\nLet me write a recursive version that exhibits this misconception:\n\ndef next_smallest_palindrome(num):\n    # Check if num+1 is a palindrome\n    if str(num + 1) == str(num + 1)[::-1]:\n        return num + 1\n    # Recursively search for the next palindrome\n    # Student thinks num will automatically increment in recursive calls\n    return next_smallest_palindrome(num)\nThe recursive function demonstrates a critical misunderstanding of parameter behavior. By calling the function with the same `num` value repeatedly, the student creates an infinite loop, believing the parameter will magically change without explicit modification. This shows a fundamental misconception about how recursive functions and parameters actually work.\n\nThe code will trigger a runtime error due to stack overflow, highlighting the dangerous nature of this programming misunderstanding. It reveals a lack of understanding about how recursive calls require explicit parameter updates to progress towards a base case.",
      "metadata": {
        "raw": "misconception_type: harmful\nerror_type: runtime\nmodification_notes: Rewrote the iterative solution as a recursive one to exhibit the misconception. The student checks if num+1 is a palindrome, and if not, recursively calls next_smallest_palindrome(num) without incrementing num. They believe that num will automatically increment in each recursive call, similar to how in the factorial example they believed n would automatically decrement. This will cause infinite recursion leading to a stack overflow error, as num never actually changes between recursive calls. From the student's perspective with their misconception, they think the parameter will magically update itself in each recursive invocation, so the code seems correct to them.",
        "misconception_type": "harmful",
        "error_type": "runtime",
        "modification_notes": "Rewrote the iterative solution as a recursive one to exhibit the misconception. The student checks if num+1 is a palindrome, and if not, recursively calls next_smallest_palindrome(num) without incrementing num. They believe that num will automatically increment in each recursive call, similar to how in the factorial example they believed n would automatically decrement. This will cause infinite recursion leading to a stack overflow error, as num never actually changes between recursive calls. From the student's perspective with their misconception, they think the parameter will magically update itself in each recursive invocation, so the code seems correct to them."
      },
      "raw_response": "<reasoning>\nThe misconception is: \"Student believes that function parameters automatically change in recursive calls without explicit modification.\"\n\nLooking at the given implementation, it's an iterative solution using a for loop. It doesn't use recursion at all. \n\nTo exhibit this misconception, I need to rewrite the solution to use recursion, but the student would fail to modify the parameter in the recursive call, believing it will change automatically.\n\nA recursive approach to this problem would be:\n1. Check if num+1 is a palindrome\n2. If yes, return it\n3. If no, recursively call with num+1\n\nBut with the misconception, the student would:\n1. Check if num+1 is a palindrome\n2. If yes, return it\n3. If no, recursively call with num (without incrementing), believing it will automatically increment\n\nLet me write this:\n\n```python\ndef next_smallest_palindrome(num):\n    candidate = num + 1\n    if str(candidate) == str(candidate)[::-1]:\n        return candidate\n    return next_smallest_palindrome(num)  # Should be next_smallest_palindrome(candidate) or next_smallest_palindrome(num+1)\n```\n\nWait, but this would cause infinite recursion. The student believes the parameter will change automatically, so from their perspective, they think `num` will increment on its own in each recursive call.\n\nActually, looking at the example more carefully:\n- The student calls `factorial(n)` instead of `factorial(n-1)`\n- They believe `n` will automatically decrement\n\nSimilarly, for the palindrome problem:\n- The student should call `next_smallest_palindrome(num)` instead of `next_smallest_palindrome(num+1)`\n- They believe `num` will automatically increment\n\nLet me write a recursive version that exhibits this misconception:\n\n```python\ndef next_smallest_palindrome(num):\n    # Check if num+1 is a palindrome\n    if str(num + 1) == str(num + 1)[::-1]:\n        return num + 1\n    # Recursively search for the next palindrome\n    # Student thinks num will automatically increment in recursive calls\n    return next_smallest_palindrome(num)\n```\n\nThe recursive function demonstrates a critical misunderstanding of parameter behavior. By calling the function with the same `num` value repeatedly, the student creates an infinite loop, believing the parameter will magically change without explicit modification. This shows a fundamental misconception about how recursive functions and parameters actually work.\n\nThe code will trigger a runtime error due to stack overflow, highlighting the dangerous nature of this programming misunderstanding. It reveals a lack of understanding about how recursive calls require explicit parameter updates to progress towards a base case.\n</reasoning>\n\n```xml\n<code>\ndef next_smallest_palindrome(num):\n    if str(num + 1) == str(num + 1)[::-1]:\n        return num + 1\n    return next_smallest_palindrome(num)\n</code>\n\n<metadata>\nmisconception_type: harmful\nerror_type: runtime\nmodification_notes: Rewrote the iterative solution as a recursive one to exhibit the misconception. The student checks if num+1 is a palindrome, and if not, recursively calls next_smallest_palindrome(num) without incrementing num. They believe that num will automatically increment in each recursive call, similar to how in the factorial example they believed n would automatically decrement. This will cause infinite recursion leading to a stack overflow error, as num never actually changes between recursive calls. From the student's perspective with their misconception, they think the parameter will magically update itself in each recursive invocation, so the code seems correct to them.\n</metadata>\n```",
      "parse_success": true,
      "sampling_order": 70,
      "random_seed_used": 42,
      "problem_misconception_index": 3,
      "global_misconception_index": 69,
      "feedback_loop": {
        "enabled": true,
        "iterations": 0,
        "evaluation_history": [
          {
            "exhibits_misconception": true,
            "reasoning": "Let me analyze this code carefully to see if it exhibits the misconception.\n\nThe misconception is: \"Student believes that function parameters automatically change in recursive calls without explicit modification.\"\n\nLooking at the code:\n```python\ndef next_smallest_palindrome(num):\n    if str(num + 1) == str(num + 1)[::-1]:\n        return num + 1\n    return next_smallest_palindrome(num)\n```\n\nIn the recursive call on the last line, the student calls `next_smallest_palindrome(num)` with the same `num` parameter, without any modification.\n\nThe intended behavior seems to be finding the next smallest palindrome after `num`. The logic is:\n1. Check if `num + 1` is a palindrome\n2. If yes, return it\n3. If no, recursively call with... `num` (unchanged)\n\nThis is problematic! If `num + 1` is not a palindrome, the function calls itself with the same `num`. This would result in infinite recursion because the condition would never change.\n\nThe correct approach would be to call `next_smallest_palindrome(num + 1)` in the recursive case, so that we keep checking successive numbers.\n\nDoes this exhibit the misconception? YES! The student is making a recursive call without modifying the parameter `num`. They seem to believe that somehow `num` will change in the recursive call, even though they haven't explicitly passed a different value.\n\nThis is exactly the pattern described in the misconception:\n- The parameter `num` is not modified in the recursive call\n- The student calls `next_smallest_palindrome(num)` instead of `next_smallest_palindrome(num + 1)`\n- This suggests they believe the parameter will somehow change automatically\n\nThis code exhibits the misconception clearly. It's also harmful in this case because it would cause infinite recursion.",
            "rationale": "This code clearly exhibits the misconception. In the recursive case (when `num + 1` is not a palindrome), the function calls `next_smallest_palindrome(num)` with the exact same parameter value without any modification. \n\nThe correct implementation should be `next_smallest_palindrome(num + 1)` to check the next number. By calling `next_smallest_palindrome(num)` instead, the student demonstrates the belief that the parameter will somehow automatically change or increment in the recursive call, even though they haven't explicitly modified it.\n\nThis pattern matches the misconception exactly: the student checks `num + 1` in the condition but then recursively calls with unchanged `num`, suggesting they believe the parameter will progress automatically. This would result in infinite recursion since the same condition would be checked repeatedly with the same value.",
            "feedback": "NONE",
            "confidence": "high",
            "misconception_type": "harmful",
            "raw_response": "<reasoning>\nLet me analyze this code carefully to see if it exhibits the misconception.\n\nThe misconception is: \"Student believes that function parameters automatically change in recursive calls without explicit modification.\"\n\nLooking at the code:\n```python\ndef next_smallest_palindrome(num):\n    if str(num + 1) == str(num + 1)[::-1]:\n        return num + 1\n    return next_smallest_palindrome(num)\n```\n\nIn the recursive call on the last line, the student calls `next_smallest_palindrome(num)` with the same `num` parameter, without any modification.\n\nThe intended behavior seems to be finding the next smallest palindrome after `num`. The logic is:\n1. Check if `num + 1` is a palindrome\n2. If yes, return it\n3. If no, recursively call with... `num` (unchanged)\n\nThis is problematic! If `num + 1` is not a palindrome, the function calls itself with the same `num`. This would result in infinite recursion because the condition would never change.\n\nThe correct approach would be to call `next_smallest_palindrome(num + 1)` in the recursive case, so that we keep checking successive numbers.\n\nDoes this exhibit the misconception? YES! The student is making a recursive call without modifying the parameter `num`. They seem to believe that somehow `num` will change in the recursive call, even though they haven't explicitly passed a different value.\n\nThis is exactly the pattern described in the misconception:\n- The parameter `num` is not modified in the recursive call\n- The student calls `next_smallest_palindrome(num)` instead of `next_smallest_palindrome(num + 1)`\n- This suggests they believe the parameter will somehow change automatically\n\nThis code exhibits the misconception clearly. It's also harmful in this case because it would cause infinite recursion.\n</reasoning>\n\n<answer>\n<exhibits_misconception>Y</exhibits_misconception>\n<rationale>\nThis code clearly exhibits the misconception. In the recursive case (when `num + 1` is not a palindrome), the function calls `next_smallest_palindrome(num)` with the exact same parameter value without any modification. \n\nThe correct implementation should be `next_smallest_palindrome(num + 1)` to check the next number. By calling `next_smallest_palindrome(num)` instead, the student demonstrates the belief that the parameter will somehow automatically change or increment in the recursive call, even though they haven't explicitly modified it.\n\nThis pattern matches the misconception exactly: the student checks `num + 1` in the condition but then recursively calls with unchanged `num`, suggesting they believe the parameter will progress automatically. This would result in infinite recursion since the same condition would be checked repeatedly with the same value.\n</rationale>\n<confidence>high</confidence>\n<feedback>NONE</feedback>\n</answer>",
            "parse_success": true
          }
        ],
        "final_evaluation": {
          "exhibits_misconception": true,
          "reasoning": "Let me analyze this code carefully to see if it exhibits the misconception.\n\nThe misconception is: \"Student believes that function parameters automatically change in recursive calls without explicit modification.\"\n\nLooking at the code:\n```python\ndef next_smallest_palindrome(num):\n    if str(num + 1) == str(num + 1)[::-1]:\n        return num + 1\n    return next_smallest_palindrome(num)\n```\n\nIn the recursive call on the last line, the student calls `next_smallest_palindrome(num)` with the same `num` parameter, without any modification.\n\nThe intended behavior seems to be finding the next smallest palindrome after `num`. The logic is:\n1. Check if `num + 1` is a palindrome\n2. If yes, return it\n3. If no, recursively call with... `num` (unchanged)\n\nThis is problematic! If `num + 1` is not a palindrome, the function calls itself with the same `num`. This would result in infinite recursion because the condition would never change.\n\nThe correct approach would be to call `next_smallest_palindrome(num + 1)` in the recursive case, so that we keep checking successive numbers.\n\nDoes this exhibit the misconception? YES! The student is making a recursive call without modifying the parameter `num`. They seem to believe that somehow `num` will change in the recursive call, even though they haven't explicitly passed a different value.\n\nThis is exactly the pattern described in the misconception:\n- The parameter `num` is not modified in the recursive call\n- The student calls `next_smallest_palindrome(num)` instead of `next_smallest_palindrome(num + 1)`\n- This suggests they believe the parameter will somehow change automatically\n\nThis code exhibits the misconception clearly. It's also harmful in this case because it would cause infinite recursion.",
          "rationale": "This code clearly exhibits the misconception. In the recursive case (when `num + 1` is not a palindrome), the function calls `next_smallest_palindrome(num)` with the exact same parameter value without any modification. \n\nThe correct implementation should be `next_smallest_palindrome(num + 1)` to check the next number. By calling `next_smallest_palindrome(num)` instead, the student demonstrates the belief that the parameter will somehow automatically change or increment in the recursive call, even though they haven't explicitly modified it.\n\nThis pattern matches the misconception exactly: the student checks `num + 1` in the condition but then recursively calls with unchanged `num`, suggesting they believe the parameter will progress automatically. This would result in infinite recursion since the same condition would be checked repeatedly with the same value.",
          "feedback": "NONE",
          "confidence": "high",
          "misconception_type": "harmful",
          "raw_response": "<reasoning>\nLet me analyze this code carefully to see if it exhibits the misconception.\n\nThe misconception is: \"Student believes that function parameters automatically change in recursive calls without explicit modification.\"\n\nLooking at the code:\n```python\ndef next_smallest_palindrome(num):\n    if str(num + 1) == str(num + 1)[::-1]:\n        return num + 1\n    return next_smallest_palindrome(num)\n```\n\nIn the recursive call on the last line, the student calls `next_smallest_palindrome(num)` with the same `num` parameter, without any modification.\n\nThe intended behavior seems to be finding the next smallest palindrome after `num`. The logic is:\n1. Check if `num + 1` is a palindrome\n2. If yes, return it\n3. If no, recursively call with... `num` (unchanged)\n\nThis is problematic! If `num + 1` is not a palindrome, the function calls itself with the same `num`. This would result in infinite recursion because the condition would never change.\n\nThe correct approach would be to call `next_smallest_palindrome(num + 1)` in the recursive case, so that we keep checking successive numbers.\n\nDoes this exhibit the misconception? YES! The student is making a recursive call without modifying the parameter `num`. They seem to believe that somehow `num` will change in the recursive call, even though they haven't explicitly passed a different value.\n\nThis is exactly the pattern described in the misconception:\n- The parameter `num` is not modified in the recursive call\n- The student calls `next_smallest_palindrome(num)` instead of `next_smallest_palindrome(num + 1)`\n- This suggests they believe the parameter will somehow change automatically\n\nThis code exhibits the misconception clearly. It's also harmful in this case because it would cause infinite recursion.\n</reasoning>\n\n<answer>\n<exhibits_misconception>Y</exhibits_misconception>\n<rationale>\nThis code clearly exhibits the misconception. In the recursive case (when `num + 1` is not a palindrome), the function calls `next_smallest_palindrome(num)` with the exact same parameter value without any modification. \n\nThe correct implementation should be `next_smallest_palindrome(num + 1)` to check the next number. By calling `next_smallest_palindrome(num)` instead, the student demonstrates the belief that the parameter will somehow automatically change or increment in the recursive call, even though they haven't explicitly modified it.\n\nThis pattern matches the misconception exactly: the student checks `num + 1` in the condition but then recursively calls with unchanged `num`, suggesting they believe the parameter will progress automatically. This would result in infinite recursion since the same condition would be checked repeatedly with the same value.\n</rationale>\n<confidence>high</confidence>\n<feedback>NONE</feedback>\n</answer>",
          "parse_success": true
        }
      }
    }
  ]
}